{
  "id": "sahar_basin",
  "name": "The Sahar Basin",
  "art": "campaign/world_map.png",
  "taken": 19,
  "regions": [
    {
      "id": "marj",
      "name": "The Marj Strip",
      "faction": "Ashwar Front",
      "doctrine": "tunnels, IEDs, ambush, human terrain",
      "blurb": "A dense enclave between the sea and Kedem's coastal plain. No mountain, no river, no depth.",
      "towns": [
        {
          "id": "beit_sahwan",
          "name": "Beit Sahwan",
          "at": [
            42.6,
            467.6
          ],
          "missions": [
            "beit_sahwan_breach",
            "beit_sahwan_1_recon",
            "beit_sahwan_2_foothold",
            "beit_sahwan_3_clearance",
            "beit_sahwan_4_subterranean"
          ]
        },
        {
          "id": "khan_rafid",
          "name": "Khan Rafid",
          "at": [
            113.7,
            385.5
          ],
          "missions": ["khan_rafid_1_recon", "khan_rafid_2_foothold", "khan_rafid_3_clearance"]
        },
        {
          "id": "deir_amun",
          "name": "Deir Amun",
          "at": [
            281.4,
            480.9
          ],
          "missions": ["deir_amun_1_recon", "deir_amun_2_foothold", "deir_amun_3_subterranean"]
        }
      ]
    },
    {
      "id": "sur",
      "name": "Sur",
      "faction": "Sarim Brigades",
      "doctrine": "rockets, ATGMs, standoff",
      "blurb": "Rockets range onto Kedem's north from behind a mountain wall.",
      "unlock": {
        "after_mission": "deir_amun_3_subterranean"
      },
      "towns": [
        {
          "id": "tel_marum",
          "name": "Tel Marum",
          "at": [
            421.4,
            55.9
          ],
          "missions": ["tel_marum_1_recon", "tel_marum_2_foothold", "tel_marum_3_clearance"]
        },
        {
          "id": "qarn_hadid",
          "name": "Qarn Hadid",
          "at": [
            548.0,
            105.0
          ],
          "missions": ["qarn_hadid_1_recon", "qarn_hadid_2_foothold", "qarn_hadid_3_clearance"]
        },
        {
          "id": "umm_zeitoun",
          "name": "Umm Zeitoun",
          "at": [
            674.4,
            153.3
          ],
          "missions": ["umm_zeitoun_1_recon", "umm_zeitoun_2_buildup", "umm_zeitoun_3_clearance", "umm_zeitoun_4_clearance"]
        }
      ]
    },
    {
      "id": "naharin",
      "name": "Naharin",
      "faction": "Rif Cells",
      "doctrine": "technicals, raids, smuggling, mobility",
      "blurb": "A green river basin of terraced pasture and cultivation. The corridor that supplied the Marj's tunnels and Sur's rocket stocks.",
      "unlock": {
        "after_mission": "umm_zeitoun_4_clearance"
      },
      "towns": [
        {
          "id": "ein_qasab",
          "name": "Ein Qasab",
          "at": [
            804.0,
            461.7
          ],
          "unlock": {
            "after_mission": "wadi_halam_3_counterraid"
          },
          "missions": [
            "ein_qasab_1_recon",
            "ein_qasab_2_foothold",
            "ein_qasab_3_buildup"
          ]
        },
        {
          "id": "wadi_halam",
          "name": "Wadi Halam",
          "at": [
            804.0,
            401.7
          ],
          "missions": [
            "wadi_halam_1_fords",
            "wadi_halam_2_laager",
            "wadi_halam_3_counterraid",
            "wadi_halam_4_village",
            "wadi_halam_5_depot"
          ]
        }
      ]
    }
  ]
}
